DEC advertises that it helped to create "the world's first expert system routinely used in an industrial environment," called XCON or:, ,Text,Single,Average,Artificial Intelligence ,PDP-11;Rl;VAX;MAGNOM;None of the above;,B
The Strategic Computing Program is a project of the:, ,Text,Single,Average,Artificial Intelligence ,Defense Advanced Research Projects Agency;National Science Foundation;Jet Propulsion Laboratory;All of the above;None of the above;,A
If a robot can alter its own trajectory in response to external conditions, it is considered to be:, ,Text,Single,Average,Artificial Intelligence ,intelligent;mobile;open loop;non-servo;None of the above;,A
Nils Nilsson headed a team at SRI that created a mobile robot named:, ,Text,Single,Average,Artificial Intelligence ,Robitics;Dedalus;Shakey;Vax;None of the above;,C
To invoke the LISP system, you must enter, ,Text,Single,Average,Artificial Intelligence ,AI;LISP;CL (Common Lisp);both b and c;None of the above;,D
The original LISP machines produced by both LMI and Symbolics were based on research performed at:, ,Text,Single,Average,Artificial Intelligence ,CMU;MIT;Stanford University;RAMD;None of the above;,B
A process that is repeated, evaluated, and refined is called:, ,Text,Single,Average,Artificial Intelligence ,diagnostic;descriptive;interpretive;iterative;None of the above;,D
Ambiguity may be caused by:, ,Text,Single,Average,Artificial Intelligence ,syntactic ambiguity;multiple word meanings;unclear antecedents;All of the above;None of the above;,D
High-resolution, bit-mapped displays are useful for displaying:, ,Text,Single,Average,Artificial Intelligence ,clearer characters;graphics;more characters;All of the above;None of the above;,D
What is the numerical range of char?, ,Text,Single,Average,Objects and Collections ,0 to 32767;0 to 65535;-256 to 255;-32768 to 32767;,B
A computer program that contains expertise in a particular domain is called an:, ,Text,Single,Average,Artificial Intelligence ,intelligent planner;automatic processor;expert system;operational symbolizer;None of the above;,C
In LISP, the function returns the first element of a list Is, ,Text,Single,Average,Artificial Intelligence ,set;car;first;second;None of the above;,B
Which of the following have people traditionally done better than computers?, ,Text,Single,Average,Artificial Intelligence ,recognizing relative importance;finding similarities;resolving ambiguity;All of the above;(a) and (c) above.;,D
The field that investigates the mechanics of human intelligence is:, ,Text,Single,Average,Artificial Intelligence ,history;cognitive science;psychology;sociology;None of the above;,B
Which type of actuator generates a good deal of power but tends to be messy?, ,Text,Single,Average,Artificial Intelligence ,electric;hydraulic;pneumatic;(B) and (c) above;None of the above;,B
Claude Shannon described the operation of electronic switching circuits with a system of mathematical logic called:, ,Text,Single,Average,Artificial Intelligence ,LISP;XLISP;Boolean algebra;neural networking;None of the above;,C
A bidirectional feedback loop links computer modelling with:, ,Text,Single,Average,Artificial Intelligence ,artificial science;heuristic processing;human intelligence;cognitive science;None of the above;,D
The new organization established to implement the Fifth Generation Project is called:, ,Text,Single,Average,Artificial Intelligence ,ICOT (Institute for New Generation Computer Technology);MITI (Ministry of International Trade and Industry);MCC (Microelectronics and Computer Technology Corporation);SCP (Stategic Computing Program);None of the above;,A
Who is considered to be the "father" of artificial intelligence?, ,Text,Single,Average,Artificial Intelligence ,Fisher Ada;John McCarthy;Allen Newell;Alan Turning;None of the above;,B
Prior to the invention of time sharing, the prevalent method of computer access was:, ,Text,Single,Average,Artificial Intelligence ,batch processing;telecommunication;remote access;All of the above;None of the above;,A
An AI technique that allows computers to understand associations and relationships between objects and events is called:, ,Text,Single,Average,Artificial Intelligence ,heuristic processing;cognitive science;relative symbolism;pattern matching;None of the above;,D
Which collection class allows you to access its elements by associating a key with an element's value, and provides synchronization?, ,Text,Single,Average,Objects and Collections ,java.util.SortedMap;java.util.TreeMap;java.util.TreeSet;java.util.Hashtable;,D
In LISP, the function evaluates both <variable> and <object> is, ,Text,Single,Average,Artificial Intelligence ,set;setq;add;eva;None of the above;,A
In 1985, the famous chess player David Levy beat a world champion chess program in four straight games by using orthodox moves that confused the program. What was the name of the chess program?, ,Text,Single,Average,Artificial Intelligence ,Kaissa;CRAY BLITZ;Golf;DIGDUG;None of the above;,B
The explanation facility of an expert system may be used to:, ,Text,Single,Average,Artificial Intelligence ,construct a diagnostic model;expedite the debugging process;explain the system's reasoning process;All of the above;both (b) and (c);,E
Which of the following are Java reserved words?, ,Text,Single,Average,Objects and Collections ,1 and 2;2 and 3;3 and 4;2 and 4;,B
Which collection class allows you to associate its elements with key values, and allows you to retrieve objects in FIFO (first-in, first-out) sequence?, ,Text,Single,Average,Objects and Collections ,java.util.ArrayList;java.util.LinkedHashMap;java.util.HashMap;java.util.TreeMap;,B
Visual clues that are helpful in computer vision include:, ,Text,Single,Average,Artificial Intelligence ,colour and motion;depth and texture;height and weight;a and b above;None of the above;,D
Which interface provides the capability to store objects using a key-value pair?, ,Text,Single,Average,Objects and Collections ,Java.util.Map;Java.util.Set;Java.util.List;Java.util.Collection;,A
Seymour Papert of the MIT AI lab created a programming environment for children called:, ,Text,Single,Average,Artificial Intelligence ,BASIC;LOGO;MYCIN;FORTRAN;None of the above;,B
Which is valid declaration of a float?, ,Text,Single,Average,Objects and Collections ,float f = 1F;;float f = 1.0;;float f = "1";;float f = 1.0d;;,A
In LISP, the function X (x). (2x+l) would be rendered as, ,Text,Single,Average,Artificial Intelligence ,(lambda (x) (+(*2 x)l));(lambda (x) (+1 (* 2x);(+ lambda (x) 1 (*2x));(* lambda(x) (+2x1);None of the above;,A
Which of the following are loaded into main memory when the computer is booted?, ,Text,Single,Average,Operating Systems Concepts ,internal command instructions;external command instructions;utility programs;word processing instructions;None of the above;,A
Weak AI is, ,Text,Single,Average,Artificial Intelligence ,the embodiment of human intellectual capabilities within a computer.;a set of computer programs that produce output that would be considered to reflect intelligence if it were generated by humans.;the study of mental faculties through the use of mental models implemented on a computer.;All of the above;None of the above;,C
In which of the following areas may ICAI programs prove to be useful?, ,Text,Single,Average,Artificial Intelligence ,educational institutions;corporations;department of Defence;All of the above;None of the above;,D
In MS-DOS 5.0, which is the number that acts as a code to uniquely identify the software product?, ,Text,Single,Average,Operating Systems Concepts ,MS;DOS;MS DOS;5.0;None of the above;,D
One of the leading American robotics centers is the Robotics Institute located at:, ,Text,Single,Average,Artificial Intelligence ,CMU;MIT;RAND;SRI;None of the above;,A
A problem is first connected to its proposed solution during the _____ stage., ,Text,Single,Average,Artificial Intelligence ,conceptualization;identification;formalization;implementation.;testing;,C
In LISP, the function assigns the symbol x to y is, ,Text,Single,Average,Artificial Intelligence ,(setq y x);(set y = 'x');(setq y = 'x');(setq y 'x');None of the above;,D
In LISP, the function returns t if <object> is a CONS cell and nil otherwise:, ,Text,Single,Average,Artificial Intelligence ,(cons <object>);(consp <object>);(eq <object>);(cous = <object>);None of the above;,B
What is the name of the computer program that contains the distilled knowledge of an expert?, ,Text,Single,Average,Artificial Intelligence ,Data base management system;Management information System;Expert system;Artificial intelligence;None of the above;,C
Natural language processing is divided into the two subfields of:, ,Text,Single,Average,Artificial Intelligence ,symbolic and numeric;time and motion;algorithmic and heuristic;understanding and generation;None of the above;,D
In a rule-based system, procedural domain knowledge is in the form of:, ,Text,Single,Average,Artificial Intelligence ,production rules;rule interpreters;meta-rules;control rules;None of the above;,A
Thrashing, ,Text,Single,Average,Operating Systems Concepts ,is a natural consequence of virtual memory systems;can always be avoided by swapping;always occurs on large computers;can be caused by poor paging algorithms;None of the above;,D
Page stealing, ,Text,Single,Average,Operating Systems Concepts ,is a sign of an efficient system;is taking page frames from other working sets;should be the tuning goal;is taking larger disk spaces for pages paged out;None of the above;,B
The hardware features of LISP machines generally include:, ,Text,Single,Average,Artificial Intelligence ,large memory and a high-speed processor;letter-quality printers and 8-inch disk drives;a mouse and a specialized keyboard;both (a) and (c);None of the above;,D
Addressing structure, ,Text,Single,Average,Operating Systems Concepts ,defines the fundamental method of determining effective operand addresses;are variations in the use of fundamental addressing structures, or some associated actions which are related to addressing.;performs indicated operations on two fast registers of the machine and leave the result in one of the registers.;all of the above;None of the above;,A
In analyzing the compilation of PL/I program, the term "Lexical analysis" is associated with, ,Text,Single,Average,Operating Systems Concepts ,recognition of basic syntactic constructs through reductions.;recognition of basic elements and creation of uniform symbols;creation of more optional matrix.;use of macro processor to produce more optimal assembly code;None of the above;,B
What is the name given to the values that are automatically provided by software to reduce keystrokes and improve a computer user's productivity?, ,Text,Single,Average,Operating Systems Concepts ,Defined values;Fixed values;Default values;Special values;None of the above;,C
Programming a robot by physically moving it through the trajectory you want it to follow is called:, ,Text,Single,Average,Artificial Intelligence ,contact sensing control;continuous-path control;robot vision control;pick-and-place control;None of the above;,B
Memory management is :, ,Text,Single,Average,Operating Systems Concepts ,not used in modern operating system;replaced with virtual memory on current systems;not used on multiprogramming systems;critical for even the simplest operating systems;None of the above;,D
The register or main memory location which contains the effective address of the operand is known as, ,Text,Single,Average,Operating Systems Concepts ,pointer;indexed register;special location;scratch pad;None of the above;,A
PROLOG is an AI programming language which solves problems with a form of symbolic logic known as predicate calculus. It was developed in 1972 at the University of Marseilles by a team of specialists. Can you name the person who headed this team?, ,Text,Single,Average,Artificial Intelligence ,Alain Colmerauer;Nicklaus Wirth;Seymour Papert;John McCarthy;None of the above;,A
A natural language generation program must decide:, ,Text,Single,Average,Artificial Intelligence ,what to say;when to say something;why it is being used;both (a) and (b);None of the above;,D
In LISP, the addition 3 + 2 is entered as, ,Text,Single,Average,Artificial Intelligence ,3 + 2;3 add 2;3 + 2 =;(+ 3 2);None of the above;,D
What of the following is considered to be a pivotal event in the history of AI., ,Text,Single,Average,Artificial Intelligence ,1949, Donald O, The organization of Behaviour,;1950, Computing Machinery and Intelligence.;1956, Dartmouth University Conference Organized by John McCarthy;1961, Computer and Computer Sense.;None of the above;,C
While working with MS-DOS, which command will you use to transfer a specific file from one disk to another?, ,Text,Single,Average,Operating Systems Concepts ,DISKCOPY;COPY;RENAME;FORMAT;None of the above;,B
What is the name of the computer program that simulates the thought processes of human beings?, ,Text,Single,Average,Artificial Intelligence ,Human logic;Expert reason;Expert system;Personal information;None of the above;,C
, ,Text,Single,Average,Objects and Collections ,No statement required.;import java.io.*;;include java.io.*;;import java.io.PrintWriter;;,A
The Memory Buffer Register (MBR), ,Text,Single,Average,Operating Systems Concepts ,is a hardware memory device which denotes the location of the current instruction being executed.;is a group of electrical circuits (hardware), that performs the intent of instructions fetched from memory.;contains the address of the memory location that is to be read from or stored into.;contains a copy of the designated memory location specified by the MAR after a "read" or the new contents of the memory prior to a "write".;None of the above;,D
Memory, ,Text,Single,Average,Operating Systems Concepts ,is a device that performs a sequence of operations specified by instructions in memory.;is the device where information is stored;is a sequence of instructions;is typically characterized by interactive processing and time-slicing of the CPU's time to allow quick response to each user.;None of the above;,B
A network with named nodes and labeled arcs that can be used to represent certain natural language grammars to facilitate parsing., ,Text,Single,Average,Artificial Intelligence ,Tree Network;Star Network;Transition Network;Complete Network;None of the above;,C
The principle of locality of reference justifies the use of, ,Text,Single,Average,Operating Systems Concepts ,reenterable;non reusable;virtual memory;cache memory;None of the above;,D
What is the name of the operating system for the laptop computer called MacLite?, ,Text,Single,Average,Operating Systems Concepts ,Windows;DOS;MS-DOS;OZ;None of the above;,D
Which company offers the LISP machine considered to be "the most powerful symbolic processor available"?, ,Text,Single,Average,Artificial Intelligence ,LMI;Symbolics;Xerox;Texas Instruments;None of the above;,B
Which of the following addressing modes, facilitates access to an operand whose location is defined relative to the beginning of the data structure in which it appears?, ,Text,Single,Average,Operating Systems Concepts ,ascending;sorting;index;indirect;None of the above;,C
Research scientists all over the world are taking steps towards building computers with circuits patterned after the complex inter connections existing among the human brain's nerve cells. What name is given to such type of computers?, ,Text,Single,Average,Artificial Intelligence ,Intelligent computers;Supercomputers;Neural network computers;Smart computers;None of the above;,C
DEC advertises that it helped to create "the world's first expert system routinely used in an industrial environment," called XCON or:, ,Text,Single,Average,Artificial Intelligence ,PDP-11;Rl;VAX;MAGNOM;None of the above;,B
The Strategic Computing Program is a project of the:, ,Text,Single,Average,Artificial Intelligence ,Defense Advanced Research Projects Agency;National Science Foundation;Jet Propulsion Laboratory;All of the above;None of the above;,A
If a robot can alter its own trajectory in response to external conditions, it is considered to be:, ,Text,Single,Average,Artificial Intelligence ,intelligent;mobile;open loop;non-servo;None of the above;,A
Nils Nilsson headed a team at SRI that created a mobile robot named:, ,Text,Single,Average,Artificial Intelligence ,Robitics;Dedalus;Shakey;Vax;None of the above;,C
While running DOS on a PC, which command would be used to duplicate the entire diskette?, ,Text,Single,Average,Operating Systems Concepts ,COPY;DISKCOPY;CHKDSK;TYPE;None of the above;,B
To invoke the LISP system, you must enter, ,Text,Single,Average,Artificial Intelligence ,AI;LISP;CL (Common Lisp);both b and c;None of the above;,D
The original LISP machines produced by both LMI and Symbolics were based on research performed at:, ,Text,Single,Average,Artificial Intelligence ,CMU;MIT;Stanford University;RAMD;None of the above;,B
A process that is repeated, evaluated, and refined is called:, ,Text,Single,Average,Artificial Intelligence ,diagnostic;descriptive;interpretive;iterative;None of the above;,D
Which of the following statements is false?, ,Text,Single,Average,Operating Systems Concepts ,the technique of storage compaction involves moving all occupied areas of storage to one end or other of main storage;compaction does not involve relocation of programs;compaction is also know as garbage collection;the system must stop everything while it performs the compaction;None of the above;,B
Which of the following rules out the use of GO TO?, ,Text,Single,Average,Operating Systems Concepts ,Flowchart;HIPO-DIAGRAMS;Nassi-Shneiderman diagram;All of the above;None of the above;,C
In virtual memory systems, Dynamic address translation, ,Text,Single,Average,Operating Systems Concepts ,is the hardware necessary to implement paging;stores pages at a specific location on disk;is useless when swapping is used;is part of the operating system paging algorithm;None of the above;,A
Ambiguity may be caused by:, ,Text,Single,Average,Artificial Intelligence ,syntactic ambiguity;multiple word meanings;unclear antecedents;All of the above;None of the above;,D
A system program that sets up an executable program in main memory ready for execution is, ,Text,Single,Average,Operating Systems Concepts ,assembler;linker;loader;compiler;None of the above;,C
High-resolution, bit-mapped displays are useful for displaying:, ,Text,Single,Average,Artificial Intelligence ,clearer characters;graphics;more characters;All of the above;None of the above;,D
What is the numerical range of char?, ,Text,Single,Average,Objects and Collections ,0 to 32767;0 to 65535;-256 to 255;-32768 to 32767;,B
A computer program that contains expertise in a particular domain is called an:, ,Text,Single,Average,Artificial Intelligence ,intelligent planner;automatic processor;expert system;operational symbolizer;None of the above;,C
The strategy of allowing processes that are logically runnable to be temporarily suspended is called, ,Text,Single,Average,Operating Systems Concepts ,preemptive scheduling;non preemptive scheduling;shortest job first;first come first served;None of the above;,A
What is the name given to the organized collection of software that controls the overall operation of a computer?, ,Text,Single,Average,Operating Systems Concepts ,Working system;Peripheral system;Operating system;Controlling system;None of the above;,C
In LISP, the function returns the first element of a list Is, ,Text,Single,Average,Artificial Intelligence ,set;car;first;second;None of the above;,B
Fragmentation of the file system, ,Text,Single,Average,Operating Systems Concepts ,occurs only if the file system is used improperly;can always be prevented;can be temporarily removed by compaction;is a characteristic of all file systems;None of the above;,C
Which of the following have people traditionally done better than computers?, ,Text,Single,Average,Artificial Intelligence ,recognizing relative importance;finding similarities;resolving ambiguity;All of the above;(a) and (c) above.;,D
The field that investigates the mechanics of human intelligence is:, ,Text,Single,Average,Artificial Intelligence ,history;cognitive science;psychology;sociology;None of the above;,B
Which type of actuator generates a good deal of power but tends to be messy?, ,Text,Single,Average,Artificial Intelligence ,electric;hydraulic;pneumatic;(B) and (c) above;None of the above;,B
Which of the following systems software does the job of merging the records from two files into one?, ,Text,Single,Average,Operating Systems Concepts ,Security software;Utility program;Networking software;Documentation system;None of the above;,B
Claude Shannon described the operation of electronic switching circuits with a system of mathematical logic called:, ,Text,Single,Average,Artificial Intelligence ,LISP;XLISP;Boolean algebra;neural networking;None of the above;,C
A bidirectional feedback loop links computer modelling with:, ,Text,Single,Average,Artificial Intelligence ,artificial science;heuristic processing;human intelligence;cognitive science;None of the above;,D
Supervisor state is, ,Text,Single,Average,Operating Systems Concepts ,never used;entered by programs when they enter the processor;required to perform any I/O;only allowed to the operating system;None of the above;,D
The new organization established to implement the Fifth Generation Project is called:, ,Text,Single,Average,Artificial Intelligence ,ICOT (Institute for New Generation Computer Technology);MITI (Ministry of International Trade and Industry);MCC (Microelectronics and Computer Technology Corporation);SCP (Stategic Computing Program);None of the above;,A
Resolution of externally defined symbols is performed by, ,Text,Single,Average,Operating Systems Concepts ,Linker;Loader;Compiler;Assembler;None of the above;,A
Who is considered to be the "father" of artificial intelligence?, ,Text,Single,Average,Artificial Intelligence ,Fisher Ada;John McCarthy;Allen Newell;Alan Turning;None of the above;,B
In which addressing mode the contents of a register specified in the instruction are first decremented, and then these contents are used as the effective address of the operands?, ,Text,Single,Average,Operating Systems Concepts ,index addressing;indirect addressing;auto increment;auto decrement;None of the above;,D
The Storage-to-Storage instructions, ,Text,Single,Average,Operating Systems Concepts ,have both their operands in the main store.;which perform an operation on a register operand and an operand which is located in the main store, generally leaving the result in the register, expect in the case of store operation when it is also written into the specified storage location.;which perform indicated operations on two fast registers of the machine and have the result in one of the registers;all of the above;None of the above;,A
A non-relocatable program is one which, ,Text,Single,Average,Operating Systems Concepts ,cannot be made to execute in any area of storage other than the one designated for it at the time of its coding or translation.;consists of a program and relevant information for its relocation.;can itself performs the relocation of its address-sensitive portions.;all of the above;None of the above;,A
Prior to the invention of time sharing, the prevalent method of computer access was:, ,Text,Single,Average,Artificial Intelligence ,batch processing;telecommunication;remote access;All of the above;None of the above;,A
Fork is, ,Text,Single,Average,Operating Systems Concepts ,the dispatching of a task;the creation of a new job;the creation of a new process;increasing the priority of a task;None of the above;,C
Assembly code data base is associated with, ,Text,Single,Average,Operating Systems Concepts ,assembly language version of the program which is created by the code generation phase and is input to the assembly phase.;a permanent table of decision rules in the form of patterns for matching with the uniform symbol table to discover syntactic structure.;consists of a full or partial list or the token's as they appear in the program. Created by Lexical analysis and used for syntax analysis and interpretation.;a permanent table which lists all key words and special symbols of the language in symbolic form.;None of the above;,A
An AI technique that allows computers to understand associations and relationships between objects and events is called:, ,Text,Single,Average,Artificial Intelligence ,heuristic processing;cognitive science;relative symbolism;pattern matching;None of the above;,D
Which collection class allows you to access its elements by associating a key with an element's value, and provides synchronization?, ,Text,Single,Average,Objects and Collections ,java.util.SortedMap;java.util.TreeMap;java.util.TreeSet;java.util.Hashtable;,D
In LISP, the function evaluates both <variable> and <object> is, ,Text,Single,Average,Artificial Intelligence ,set;setq;add;eva;None of the above;,A
In 1985, the famous chess player David Levy beat a world champion chess program in four straight games by using orthodox moves that confused the program. What was the name of the chess program?, ,Text,Single,Average,Artificial Intelligence ,Kaissa;CRAY BLITZ;Golf;DIGDUG;None of the above;,B
User-Friendly Systems are:, ,Text,Single,Average,Operating Systems Concepts ,required for object-oriented programming;easy to develop;common among traditional mainframe operating systems;becoming more common;None of the above;,D
